Text,Category
"Champion an eco-friendly lifestyle. Focus on sustainability, recycling, and energy conservation to make a positive impact on the environment.",Blog
"Explore pathways to personal growth and individual goals. Dive into topics like goal-setting, self-discovery, and positive transformation for a fulfilling life.",Blog
"Unveil the world of beauty and skincare. Learn about skincare products, makeup techniques, and self-care routines to enhance your natural radiance.",Blog
"Discover the wonders of outdoor activities. Engage in camping, hiking, fishing, and more to connect with nature and experience thrilling adventures.",Blog
"Cultivate an interest in different cultures and traditions. Learn about languages, customs, and cuisines to appreciate the diversity of the world.",Blog
"Embrace the importance of healthy eating and food choices. Focus on maintaining a balanced diet, ensuring food safety, and selecting nutritious ingredients.",Blog
"Practice an eco-friendly lifestyle. Explore environmental protection, recycling practices, and energy-saving methods to contribute to a sustainable planet.",Blog
"Nurture your fascination with beautiful flowers and plants. Learn about gardening techniques, plant care, and the rewards of cultivating your own green oasis.",Blog
"Embark on a spiritual journey through religion and philosophy. Reflect on faith, ponder existential questions, and seek meaning and enlightenment.",Blog
"Unleash your creativity through art and various forms of expression. Experiment with painting, sculpting, designing, and find your artistic voice.",Blog
"Understand the significance of health and fitness. Explore workout routines, nutrition plans, and relaxation techniques to achieve holistic well-being.",Blog
"Dive into the world of business and economics. Learn about entrepreneurship, financial strategies, and market trends to navigate the dynamic business landscape.",Blog
"Explore the realm of psychology and mental health. Discover effective stress management, emotional well-being, and strategies for maintaining a positive mindset.",Blog
"Uncover the magic of a healthy lifestyle. Learn about exercise routines, nutritious diets, and relaxation techniques to achieve a harmonious body and mind.",Blog
"Unlock the secrets of effective communication and building meaningful relationships. Enhance your interpersonal skills to foster deeper connections with others.",Blog
"Embrace your hobbies and talents. Whether it's playing a musical instrument, engaging in sports, or pursuing creative arts, find joy in your unique passions.",Blog
"Champion sustainable living and environmental stewardship. Explore green practices, recycling, and energy-saving techniques to contribute to a cleaner planet.",Blog
"Embark on a journey of self-improvement and personal development. Discover the power of goal-setting, self-discovery, and positive changes for a brighter future.",Blog
"Discover the art of skincare and beauty routines. Explore effective skincare products, makeup techniques, and self-care practices for radiant confidence.",Blog
"Experience the thrill of outdoor adventures. Engage in activities like camping, hiking, and biking to connect with nature and embrace the wonders of the wild.",Blog
"Immerse yourself in different cultures and traditions. Learn about languages, customs, and cuisine to celebrate the rich diversity of our global community.",Blog
"Prioritize a healthy lifestyle through proper nutrition and mindful eating. Explore the benefits of balanced diets, nutrient-rich foods, and the joy of cooking.",Blog
"Promote eco-conscious living and environmental sustainability. Discover ways to reduce your carbon footprint, embrace renewable resources, and support the planet.",Blog
"Delve into the world of gardening and plant care. Learn about cultivating beautiful flowers, growing your own produce, and nurturing a vibrant garden.",Blog
"Embark on a spiritual exploration of faith and philosophy. Reflect on the meaning of life, the nature of existence, and the pursuit of spiritual enlightenment.",Blog
"Unleash your creativity through various artistic expressions. Dive into painting, sculpting, writing, or any form of art that ignites your imagination.",Blog
"Embrace a holistic approach to health and wellness. Explore fitness routines, balanced nutrition, and mindfulness practices for a harmonious body and mind.",Blog
"Navigate the realms of business and economics. Learn about entrepreneurship, financial management, and market trends to thrive in the world of commerce.",Blog
"Discover the power of mental well-being and emotional intelligence. Explore techniques for stress reduction, cultivating positive emotions, and fostering healthy relationships.",Blog
"Immerse yourself in a balanced lifestyle that nurtures both body and mind. Learn about exercise, nutrition, and mindfulness for a fulfilling and vibrant life.",Blog
"Unlock effective communication skills and the art of building connections. Foster meaningful relationships by understanding empathy, active listening, and effective dialogue.",Blog
"Indulge in your hobbies and talents. Whether it's crafting, playing sports, or playing a musical instrument, find joy in your unique creative pursuits.",Blog
"Champion a sustainable lifestyle and embrace eco-friendly practices. Learn about recycling, energy conservation, and environmentally conscious choices for a better world.",Blog
"Embark on a journey of personal growth and self-discovery. Explore mindfulness, goal-setting, and the pursuit of happiness to lead a more fulfilling life.",Blog
"Explore the world of skincare and beauty. Discover effective skincare routines, makeup techniques, and self-care practices to enhance your natural radiance.",Blog
